<!--
  Application's default settings.

  Author: Sebastien Vauclair
  Version: $Revision: 1.4 $ $Date: 2003/08/06 13:08:58 $
  -->

<!-- This file is automatically generated. -->
<!-- Any additions might be overwritten without notice. -->

<!DOCTYPE settings SYSTEM "settings.dtd">

<settings
  >

  <default-filters
    full-names="Common.Highlight-hot-spots Common.Display-total-time-percent Common.Display-total-time"
    />

  <filter-customization
    full-name="Common.Highlight-hot-spots"
    >

    <parameter
      name="color-distribution"
      value="-16777216;-14942208;-13107200;-11206656;-9371648;-7536640;-5636096;-3801088;-1966080;-65536"
      />

  </filter-customization>

  <filter-customization
    full-name="Common.Display-total-time-percent"
    >

    <parameter
      name="relative-to-parent"
      value="false"
      />

  </filter-customization>

  <filter-customization
    full-name="Common.Display-total-time"
    >

    <parameter
      name="use-best-unit"
      value="true"
      />

  </filter-customization>

  <filter-customization
    full-name="Common.Sort-by-text"
    >

    <parameter
      name="descending-sort-order"
      value="false"
      />

  </filter-customization>

  <filter-customization
    full-name="Common.Sort-by-total-time"
    >

    <parameter
      name="descending-sort-order"
      value="true"
      />

  </filter-customization>

  <filter-customization
    full-name="Common.Remove-packages"
    >

    <parameter
      name="packages"
      value="org.jboss"
      />

  </filter-customization>

  <run-program-dialog
    source-paths="c:\prog\jdk\src;c:\java"
    command-template="emacs +%l %p%f"
    />

</settings>
